{
  "schema_version": "1.0",
  "metadata": {
    "source": "JRDB PACI",
    "race_date": "2025-11-01",
    "data_phase": "pre_race",
    "generated_at": "2026-10-13T14:47:18.627868+00:00",
    "history_enrichment": {
      "version": "1.0",
      "base_schema_version": "0.2",
      "recent_runs_max": 5,
      "older_runs_max": 3,
      "stats_window_years": 5,
      "as_of_exclusive": "2025-11-01",
      "future_leakage_policy": "all rolling statistics from JRDB Analysis canonical with race_date < target_date",
      "pedigree_enrichment": {
        "identity_version": "P1-0.1",
        "context_version": "P2-0.1",
        "status": "ACTIVE",
        "scoring": false,
        "identity_source": "JRDB Analysis canonical target identity projection",
        "historical_context_source": "JRDB Analysis canonical (as-of-exclusive)",
        "approved_identity_fields": [
          "horse_id",
          "sire_name",
          "dam_name",
          "broodmare_sire_name",
          "sire_line_code",
          "broodmare_sire_line_code"
        ],
        "historical_dimensions": [
          "sire_name",
          "broodmare_sire_name"
        ],
        "condition_scope": "venue_surface_exact_distance_plus_target_distance_ranges",
        "small_sample_policy": "retain_with_sample_size",
        "missing_field_policy": "null_no_guess",
        "result_fields_exposed": false
      },
      "distance_range_policy": {
        "ranges": [
          {
            "min_m": 1000,
            "max_m": 1400
          },
          {
            "min_m": 1400,
            "max_m": 1800
          },
          {
            "min_m": 1800,
            "max_m": 2400
          },
          {
            "min_m": 2500,
            "max_m": null
          }
        ],
        "overlap_boundaries_m": [
          1400,
          1800
        ],
        "long_distance_min_m": 2500
      },
      "sample_size_band_policy": {
        "none": "starts = 0",
        "small": "starts = 1-19",
        "moderate": "starts = 20-49",
        "sufficient": "starts >= 50",
        "semantic": "descriptive sample-size band only; not statistical significance"
      },
      "history_scope": "jrdb_jra_history",
      "overseas_history_policy": "not_guaranteed",
      "warning_count": 0,
      "warnings": [],
      "analysis_backend": "parquet_duckdb",
      "analysis_source": {
        "kind": "PARQUET",
        "backend": "parquet_duckdb",
        "path": "/tmp/historical/analysis",
        "manifest_path": "/tmp/historical/analysis/generations/analysis-v1_3-postrace-20260927-01/manifest.json",
        "generation_id": "analysis-v1_3-postrace-20260927-01",
        "min_race_date": "2016-01-05",
        "max_race_date": "2026-09-27",
        "rows": 517461,
        "query_count": 9,
        "parquet_scan_count": 9
      }
    },
    "racereview_enrichment": {
      "version": "RRDB-RaceNote-0.1",
      "status": "ACTIVE",
      "current_generation_id": "jrdb_race_review_v0_1_incremental_g38327108923",
      "review_schema_version": "v0.1",
      "review_logic_version": "v0.1.1",
      "baseline_version": "asof-median-loo-v0.1",
      "recommendation_contract_version": "rrdb-recommendation-signals-v0.3",
      "recommendation_grade_status": "DISABLED",
      "operational_lookback_days": 730,
      "legacy_next_watch_rule_version": null,
      "legacy_next_watch_status": "HISTORICAL_COMPATIBILITY_ONLY",
      "as_of_exclusive": "2025-11-01",
      "horse_identity": "JRDB_BLOOD_REGISTRATION_NO",
      "name_fallback": false,
      "scoring": false,
      "target_result_exposed": false,
      "market_exposed": false
    }
  },
  "race": {
    "date": "2025-11-01",
    "venue": "京都",
    "meeting": "3",
    "day": "a",
    "race_no": 5,
    "post_time": "12:25",
    "race_name": null,
    "surface": "芝",
    "distance_m": 2000,
    "turn": "右",
    "course_layout": "通常（内）",
    "race_type": "2歳",
    "class": "新馬",
    "race_conditions": [
      "混合",
      "地方指定"
    ],
    "weight_rule": "馬齢",
    "grade": null,
    "field_size": 9,
    "race_trends": {
      "frame": {
        "1": {
          "starts": 134,
          "wins": 11,
          "top3": 34,
          "win_rate": 8.2,
          "top3_rate": 25.4,
          "sample_size_band": "sufficient",
          "period": "2021-2025YTD",
          "as_of_exclusive": "2025-11-01",
          "track_condition_scope": "all_conditions",
          "source": "JRDB Analysis canonical (as-of-exclusive)",
          "distance_ranges": [
            {
              "min_m": 1800,
              "max_m": 2400,
              "starts": 372,
              "wins": 26,
              "top3": 92,
              "win_rate": 7.0,
              "top3_rate": 24.7,
              "sample_size_band": "sufficient",
              "period": "2021-2025YTD",
              "as_of_exclusive": "2025-11-01",
              "track_condition_scope": "all_conditions",
              "source": "JRDB Analysis canonical (as-of-exclusive)"
            }
          ]
        },
        "2": {
          "starts": 141,
          "wins": 11,
          "top3": 34,
          "win_rate": 7.8,
          "top3_rate": 24.1,
          "sample_size_band": "sufficient",
          "period": "2021-2025YTD",
          "as_of_exclusive": "2025-11-01",
          "track_condition_scope": "all_conditions",
          "source": "JRDB Analysis canonical (as-of-exclusive)",
          "distance_ranges": [
            {
              "min_m": 1800,
              "max_m": 2400,
              "starts": 390,
              "wins": 34,
              "top3": 103,
              "win_rate": 8.7,
              "top3_rate": 26.4,
              "sample_size_band": "sufficient",
              "period": "2021-2025YTD",
              "as_of_exclusive": "2025-11-01",
              "track_condition_scope": "all_conditions",
              "source": "JRDB Analysis canonical (as-of-exclusive)"
            }
          ]
        },
        "3": {
          "starts": 153,
          "wins": 12,
          "top3": 45,
          "win_rate": 7.8,
          "top3_rate": 29.4,
          "sample_size_band": "sufficient",
          "period": "2021-2025YTD",
          "as_of_exclusive": "2025-11-01",
          "track_condition_scope": "all_conditions",
          "source": "JRDB Analysis canonical (as-of-exclusive)",
          "distance_ranges": [
            {
              "min_m": 1800,
              "max_m": 2400,
              "starts": 417,
              "wins": 34,
              "top3": 120,
              "win_rate": 8.2,
              "top3_rate": 28.8,
              "sample_size_band": "sufficient",
              "period": "2021-2025YTD",
              "as_of_exclusive": "2025-11-01",
              "track_condition_scope": "all_conditions",
              "source": "JRDB Analysis canonical (as-of-exclusive)"
            }
          ]
        },
        "4": {
          "starts": 162,
          "wins": 23,
          "top3": 52,
          "win_rate": 14.2,
          "top3_rate": 32.1,
          "sample_size_band": "sufficient",
          "period": "2021-2025YTD",
          "as_of_exclusive": "2025-11-01",
          "track_condition_scope": "all_conditions",
          "source": "JRDB Analysis canonical (as-of-exclusive)",
          "distance_ranges": [
            {
              "min_m": 1800,
              "max_m": 2400,
              "starts": 440,
              "wins": 46,
              "top3": 123,
              "win_rate": 10.5,
              "top3_rate": 28.0,
              "sample_size_band": "sufficient",
              "period": "2021-2025YTD",
              "as_of_exclusive": "2025-11-01",
              "track_condition_scope": "all_conditions",
              "source": "JRDB Analysis canonical (as-of-exclusive)"
            }
          ]
        },
        "5": {
          "starts": 173,
          "wins": 14,
          "top3": 42,
          "win_rate": 8.1,
          "top3_rate": 24.3,
          "sample_size_band": "sufficient",
          "period": "2021-2025YTD",
          "as_of_exclusive": "2025-11-01",
          "track_condition_scope": "all_conditions",
          "source": "JRDB Analysis canonical (as-of-exclusive)",
          "distance_ranges": [
            {
              "min_m": 1800,
              "max_m": 2400,
              "starts": 473,
              "wins": 47,
              "top3": 128,
              "win_rate": 9.9,
              "top3_rate": 27.1,
              "sample_size_band": "sufficient",
              "period": "2021-2025YTD",
              "as_of_exclusive": "2025-11-01",
              "track_condition_scope": "all_conditions",
              "source": "JRDB Analysis canonical (as-of-exclusive)"
            }
          ]
        },
        "6": {
          "starts": 181,
          "wins": 10,
          "top3": 40,
          "win_rate": 5.5,
          "top3_rate": 22.1,
          "sample_size_band": "sufficient",
          "period": "2021-2025YTD",
          "as_of_exclusive": "2025-11-01",
          "track_condition_scope": "all_conditions",
          "source": "JRDB Analysis canonical (as-of-exclusive)",
          "distance_ranges": [
            {
              "min_m": 1800,
              "max_m": 2400,
              "starts": 500,
              "wins": 34,
              "top3": 111,
              "win_rate": 6.8,
              "top3_rate": 22.2,
              "sample_size_band": "sufficient",
              "period": "2021-2025YTD",
              "as_of_exclusive": "2025-11-01",
              "track_condition_scope": "all_conditions",
              "source": "JRDB Analysis canonical (as-of-exclusive)"
            }
          ]
        },
        "7": {
          "starts": 203,
          "wins": 22,
          "top3": 55,
          "win_rate": 10.8,
          "top3_rate": 27.1,
          "sample_size_band": "sufficient",
          "period": "2021-2025YTD",
          "as_of_exclusive": "2025-11-01",
          "track_condition_scope": "all_conditions",